{
  "event_id": "01K0M0AA1A0M0AA1A0M0AA1A0M",
  "event_type": "gateway.ocpp.meter_values.received.v1",
  "schema_version": 1,
  "occurred_at": "2026-07-22T04:30:00.000Z",
  "tenant_id": "01K0M0BB2B0M0BB2B0M0BB2B0M",
  "aggregate_type": "charging_station",
  "aggregate_id": "01K0M0CC3C0M0CC3C0M0CC3C0M",
  "correlation_id": "01K0M0DD4D0M0DD4D0M0DD4D0M",
  "causation_id": "01K0M0EE5E0M0EE5E0M0EE5E0M",
  "data": {
    "charge_point_identity": "CP-001",
    "protocol": "ocpp2.0.1",
    "gateway_node_id": "01K0M0FF6F0M0FF6F0M0FF6F0M",
    "connection_id": "01K0M0GG7G0M0GG7G0M0GG7G0M",
    "ocpp_message_id": "ocpp-message-42",
    "protocol_timestamp": "2026-07-22T04:29:59.000Z",
    "clock_skew_seconds": -1,
    "clock_skew_detected": false,
    "evse_id": 1,
    "samples": [
      {
        "timestamp": "2026-07-22T04:29:59.000Z",
        "measurand": "Energy.Active.Import.Register",
        "value": 18420,
        "unit": "Wh",
        "context": "Sample.Periodic",
        "phase": null
      }
    ]
  }
}
